{
  "id": "playwright",
  "category": "testing",
  "version": "0.1.0",
  "enabledByDefault": false,
  "env": [],
  "permissions": { "network": ["127.0.0.1"], "filesystem": "project-read", "actions": ["read"] },
  "cost": { "paid": false },
  "docs": "docs/gates.md#tools",
  "status": "implemented-tested"
}
